{"schema":"highergraphen.semantic_proof.report.v1","report_type":"semantic_proof","report_version":1,"metadata":{"command":"highergraphen semantic-proof verify","runtime_package":"higher-graphen-runtime","runtime_crate":"higher_graphen_runtime","cli_package":"highergraphen-cli"},"scenario":{"input_schema":"highergraphen.semantic_proof.input.v1","source":{"kind":"code","uri":"git:fixture","title":"semantic proof fixture","confidence":1.0,"adapters":["semantic-proof-fixture.v1"]},"theorem":{"id":"theorem:semantic:pricing","summary":"Pricing typed signature is preserved.","law_ids":["law:semantic:signature-preserved"],"morphism_ids":["morphism:semantic:pricing-signature"]},"semantic_cells":[{"id":"cell:semantic:pricing:base","cell_type":"mir_function","label":"base calculate_discount MIR","confidence":0.9},{"id":"cell:semantic:pricing:head","cell_type":"mir_function","label":"head calculate_discount MIR","confidence":0.9}],"morphisms":[{"id":"morphism:semantic:pricing-signature","morphism_type":"typed_signature_preservation","source_ids":["cell:semantic:pricing:base"],"target_ids":["cell:semantic:pricing:head"],"law_ids":["law:semantic:signature-preserved"],"confidence":0.86}],"laws":[{"id":"law:semantic:signature-preserved","summary":"Public typed signature is preserved.","applies_to_ids":["morphism:semantic:pricing-signature"],"confidence":0.88}],"proof_certificates":[{"id":"certificate:semantic:pricing","certificate_type":"formal_proof","backend":"kani","backend_version":"1.0.0","theorem_id":"theorem:semantic:pricing","law_ids":["law:semantic:signature-preserved"],"morphism_ids":["morphism:semantic:pricing-signature"],"witness_ids":["cell:semantic:pricing:base","cell:semantic:pricing:head"],"input_hash":"sha256:input","proof_hash":"sha256:proof","confidence":0.91,"review_status":"accepted"}],"verification_policy":{"accepted_backends":["kani","prusti"],"require_input_hash":true,"require_proof_hash":true,"require_accepted_review":true}},"result":{"status":"proved","accepted_certificate_ids":["certificate:semantic:pricing"],"proof_objects":[{"id":"proof:semantic:certificate-semantic-pricing","theorem_ids":["theorem:semantic:pricing"],"law_ids":["law:semantic:signature-preserved"],"morphism_ids":["morphism:semantic:pricing-signature"],"certificate_ids":["certificate:semantic:pricing"],"witness_ids":["cell:semantic:pricing:base","cell:semantic:pricing:head"],"summary":"Certificate certificate:semantic:pricing proves Pricing typed signature is preserved. with backend kani 1.0.0.","confidence":0.91,"review_status":"accepted"}],"source_ids":["theorem:semantic:pricing","law:semantic:signature-preserved","morphism:semantic:pricing-signature","certificate:semantic:pricing","proof:semantic:certificate-semantic-pricing","cell:semantic:pricing:base","cell:semantic:pricing:head"]},"projection":{"audience":"human","purpose":"test_gap_detection","summary":"Semantic proof status Proved with 1 proof objects, 0 counterexamples, and 0 issues.","recommended_actions":["Use accepted proof_objects as formal verification cells for downstream HG workflows."],"information_loss":[{"description":"Semantic proof verification validates HG proof certificates and policy references; external backend proof checking, MIR extraction, and SMT/model-check execution occur before this bounded input.","source_ids":["theorem:semantic:pricing","law:semantic:signature-preserved","morphism:semantic:pricing-signature","certificate:semantic:pricing","proof:semantic:certificate-semantic-pricing","cell:semantic:pricing:base","cell:semantic:pricing:head"]}],"source_ids":["theorem:semantic:pricing","law:semantic:signature-preserved","morphism:semantic:pricing-signature","certificate:semantic:pricing","proof:semantic:certificate-semantic-pricing","cell:semantic:pricing:base","cell:semantic:pricing:head"],"human_review":{"audience":"human","purpose":"test_gap_detection","summary":"Semantic proof status Proved with 1 proof objects, 0 counterexamples, and 0 issues.","recommended_actions":["Use accepted proof_objects as formal verification cells for downstream HG workflows."],"source_ids":["theorem:semantic:pricing","law:semantic:signature-preserved","morphism:semantic:pricing-signature","certificate:semantic:pricing","proof:semantic:certificate-semantic-pricing","cell:semantic:pricing:base","cell:semantic:pricing:head"],"information_loss":[{"description":"Semantic proof verification validates HG proof certificates and policy references; external backend proof checking, MIR extraction, and SMT/model-check execution occur before this bounded input.","source_ids":["theorem:semantic:pricing","law:semantic:signature-preserved","morphism:semantic:pricing-signature","certificate:semantic:pricing","proof:semantic:certificate-semantic-pricing","cell:semantic:pricing:base","cell:semantic:pricing:head"]}]},"ai_view":{"audience":"ai_agent","purpose":"test_gap_detection","records":[{"id":"theorem:semantic:pricing","record_type":"check_result","summary":"Pricing typed signature is preserved.","source_ids":["theorem:semantic:pricing"],"confidence":1.0,"review_status":"accepted"},{"id":"proof:semantic:certificate-semantic-pricing","record_type":"check_result","summary":"Certificate certificate:semantic:pricing proves Pricing typed signature is preserved. with backend kani 1.0.0.","source_ids":["certificate:semantic:pricing"],"confidence":0.91,"review_status":"accepted"}],"source_ids":["theorem:semantic:pricing","law:semantic:signature-preserved","morphism:semantic:pricing-signature","certificate:semantic:pricing","proof:semantic:certificate-semantic-pricing","cell:semantic:pricing:base","cell:semantic:pricing:head"],"information_loss":[{"description":"Semantic proof verification validates HG proof certificates and policy references; external backend proof checking, MIR extraction, and SMT/model-check execution occur before this bounded input.","source_ids":["theorem:semantic:pricing","law:semantic:signature-preserved","morphism:semantic:pricing-signature","certificate:semantic:pricing","proof:semantic:certificate-semantic-pricing","cell:semantic:pricing:base","cell:semantic:pricing:head"]}]},"audit_trace":{"audience":"audit","purpose":"audit_trace","source_ids":["theorem:semantic:pricing","law:semantic:signature-preserved","morphism:semantic:pricing-signature","certificate:semantic:pricing","proof:semantic:certificate-semantic-pricing","cell:semantic:pricing:base","cell:semantic:pricing:head"],"information_loss":[{"description":"Semantic proof verification validates HG proof certificates and policy references; external backend proof checking, MIR extraction, and SMT/model-check execution occur before this bounded input.","source_ids":["theorem:semantic:pricing","law:semantic:signature-preserved","morphism:semantic:pricing-signature","certificate:semantic:pricing","proof:semantic:certificate-semantic-pricing","cell:semantic:pricing:base","cell:semantic:pricing:head"]}],"traces":[{"source_id":"theorem:semantic:pricing","role":"semantic_proof_source","represented_in":["human_review","ai_view","audit_trace"]},{"source_id":"law:semantic:signature-preserved","role":"semantic_proof_source","represented_in":["human_review","ai_view","audit_trace"]},{"source_id":"morphism:semantic:pricing-signature","role":"semantic_proof_source","represented_in":["human_review","ai_view","audit_trace"]},{"source_id":"certificate:semantic:pricing","role":"semantic_proof_source","represented_in":["human_review","ai_view","audit_trace"]},{"source_id":"proof:semantic:certificate-semantic-pricing","role":"semantic_proof_source","represented_in":["human_review","ai_view","audit_trace"]},{"source_id":"cell:semantic:pricing:base","role":"semantic_proof_source","represented_in":["human_review","ai_view","audit_trace"]},{"source_id":"cell:semantic:pricing:head","role":"semantic_proof_source","represented_in":["human_review","ai_view","audit_trace"]}]}}}